<?xml version="1.0" encoding="UTF-8"?>
<xs:schema xmlns:xs="http://www.w3.org/2001/XMLSchema" attributeFormDefault="unqualified" elementFormDefault="qualified">
  <xs:element name="geometry">
    <xs:complexType>
      <xs:sequence>
        <xs:element name="rooms" maxOccurs="1" minOccurs="1">
          <xs:complexType>
            <xs:sequence>
              <xs:element name="room" maxOccurs="unbounded" minOccurs="1">
                <xs:complexType>
                  <xs:sequence>
                    <xs:element name="subroom" maxOccurs="unbounded" minOccurs="1">
                      <xs:complexType>
                        <xs:sequence>
                          <xs:element name="polygon" maxOccurs="unbounded" minOccurs="0">
                            <xs:complexType>
                              <xs:sequence>
                                <xs:element name="vertex" maxOccurs="unbounded" minOccurs="0">
                                  <xs:complexType>
                                    <xs:simpleContent>
                                      <xs:extension base="xs:string">
                                        <xs:attribute type="xs:float" name="px" use="required" />
                                        <xs:attribute type="xs:float" name="py" use="required" />
                                      </xs:extension>
                                    </xs:simpleContent>
                                  </xs:complexType>
                                </xs:element>
                              </xs:sequence>
                              <xs:attribute type="xs:string" name="caption" use="required" />
                            </xs:complexType>
                          </xs:element>
                          <xs:element name="obstacle" maxOccurs="unbounded" minOccurs="0">
                            <xs:complexType>
                              <xs:sequence>
                                <xs:element name="polygon">
                                  <xs:complexType>
                                    <xs:sequence>
                                      <xs:element name="vertex" maxOccurs="unbounded" minOccurs="0">
                                        <xs:complexType>
                                          <xs:simpleContent>
                                            <xs:extension base="xs:string">
                                              <xs:attribute type="xs:float" name="px" use="required" />
                                              <xs:attribute type="xs:float" name="py" use="required" />
                                            </xs:extension>
                                          </xs:simpleContent>
                                        </xs:complexType>
                                      </xs:element>
                                    </xs:sequence>
                                    <xs:attribute type="xs:string" name="caption" use="optional" />
                                  </xs:complexType>
                                </xs:element>
                              </xs:sequence>
                              <xs:attribute type="xs:int" name="id" use="required" />
                              <xs:attribute type="xs:string" name="caption" use="optional" />
                              <xs:attribute type="xs:float" name="height" use="optional" />
                              <xs:attribute type="xs:int" name="closed" use="optional" />
                            </xs:complexType>
                          </xs:element>
                          <xs:element name="up" minOccurs="0">
                            <xs:complexType>
                              <xs:simpleContent>
                                <xs:extension base="xs:string">
                                  <xs:attribute type="xs:float" name="px" use="required" />
                                  <xs:attribute type="xs:byte" name="py" use="required" />
                                </xs:extension>
                              </xs:simpleContent>
                            </xs:complexType>
                          </xs:element>
                          <xs:element name="down" minOccurs="0">
                            <xs:complexType>
                              <xs:simpleContent>
                                <xs:extension base="xs:string">
                                  <xs:attribute type="xs:float" name="px" use="required" />
                                  <xs:attribute type="xs:byte" name="py" use="required" />
                                </xs:extension>
                              </xs:simpleContent>
                            </xs:complexType>
                          </xs:element>
                        </xs:sequence>
                        <xs:attribute type="xs:int" name="id" use="required" />
                        <xs:attribute type="xs:string" name="caption" use="optional" />
                        <xs:attribute type="xs:float" name="A_x" use="optional" />
                        <xs:attribute type="xs:float" name="B_y" use="optional" />
                        <xs:attribute type="xs:float" name="C" use="optional" />
                        <xs:attribute name="class" use="required">
                          <xs:simpleType>
                            <xs:restriction base="xs:string">
                              <xs:enumeration value="stair" />
                              <xs:enumeration value="subroom" />
                              <xs:enumeration value="floor" />
                            </xs:restriction>
                          </xs:simpleType>
                        </xs:attribute>
                      </xs:complexType>
                    </xs:element>
                    <xs:element name="crossings" minOccurs="0" maxOccurs="unbounded">
                      <xs:complexType>
                        <xs:sequence>
                          <xs:element name="crossing" maxOccurs="unbounded" minOccurs="0">
                            <xs:complexType>
                              <xs:sequence>
                                <xs:element name="vertex" maxOccurs="unbounded" minOccurs="0">
                                  <xs:complexType>
                                    <xs:simpleContent>
                                      <xs:extension base="xs:string">
                                        <xs:attribute type="xs:float" name="px" use="required" />
                                        <xs:attribute type="xs:float" name="py" use="required" />
                                      </xs:extension>
                                    </xs:simpleContent>
                                  </xs:complexType>
                                </xs:element>
                              </xs:sequence>
                              <xs:attribute type="xs:int" name="id" use="required" />
                              <xs:attribute type="xs:int" name="subroom1_id" use="required" />
                              <xs:attribute type="xs:int" name="subroom2_id" use="required" />
                            </xs:complexType>
                          </xs:element>
                        </xs:sequence>
                      </xs:complexType>
                    </xs:element>
                  </xs:sequence>
                  <xs:attribute type="xs:int" name="id" use="required" />
                  <xs:attribute type="xs:string" name="caption" use="optional" />
                </xs:complexType>
              </xs:element>
            </xs:sequence>
          </xs:complexType>
        </xs:element>
        <xs:element name="transitions">
          <xs:complexType>
            <xs:sequence>
              <xs:element name="transition" maxOccurs="unbounded" minOccurs="1">
                <xs:complexType>
                  <xs:sequence>
                    <xs:element name="vertex" maxOccurs="unbounded" minOccurs="0">
                      <xs:complexType>
                        <xs:simpleContent>
                          <xs:extension base="xs:string">
                            <xs:attribute type="xs:float" name="px" use="required" />
                            <xs:attribute type="xs:float" name="py" use="required" />
                          </xs:extension>
                        </xs:simpleContent>
                      </xs:complexType>
                    </xs:element>
                  </xs:sequence>
                  <xs:attribute type="xs:int" name="id" use="required" />
                  <xs:attribute type="xs:string" name="caption" use="required" />
                  <xs:attribute type="xs:string" name="type" use="optional" />
                  <xs:attribute type="xs:int" name="room1_id" use="required" />
                  <xs:attribute type="xs:int" name="subroom1_id" use="required" />
                  <xs:attribute type="xs:int" name="room2_id" use="required" />
                  <xs:attribute type="xs:int" name="subroom2_id" use="required" />
                </xs:complexType>
              </xs:element>
            </xs:sequence>
          </xs:complexType>
        </xs:element>
      </xs:sequence>
      <xs:attribute type="xs:string" name="caption" use="required" />
      <xs:attribute name="version" use="required">
        <xs:simpleType>
          <xs:restriction base="xs:float">
            <xs:enumeration value="0.8" />
          </xs:restriction>
        </xs:simpleType>
      </xs:attribute>
      <xs:attribute name="unit" use="required">
        <xs:simpleType>
          <xs:restriction base="xs:string">
            <xs:enumeration value="m" />
          </xs:restriction>
        </xs:simpleType>
      </xs:attribute>
    </xs:complexType>
  </xs:element>
</xs:schema>

