<?xml version="1.0" encoding="UTF-8" standalone="yes"?>

<geometry version="0.5" caption="test" unit="m" 
xmlns:xsi="http://www.w3.org/2001/XMLSchema-instance" 
xsi:noNamespaceSchemaLocation="http://xsd.jupedsim.org/0.6/jps_geometry.xsd">
	<rooms>
		<room id="0" caption="hall">
			<subroom id="0" closed="0" class="subroom">
				<polygon caption="wall">
					<vertex px="0.0" py="18.0" />
					<vertex px="0.0" py="30.0" />
					<vertex px="12.0" py="30.0" />
				</polygon>
				<polygon caption="wall">
					<vertex px="18.0" py="30.0" />
					<vertex px="30.0" py="30.0" />
					<vertex px="30.0" py="18.0" />
				</polygon>
				<polygon caption="wall">
					<vertex px="30.0" py="12.0" />
					<vertex px="30.0" py="0.0" />
					<vertex px="18.0" py="0.0" />
				</polygon>
				<polygon caption="wall">
					<vertex px="12.0" py="0.0" />
					<vertex px="0.0" py="0.0" />
					<vertex px="0.0" py="12.0" />
				</polygon>
			</subroom>
		</room>
	</rooms>

	<transitions>
		<transition id="2" caption="exit" type="emergency"
			room1_id="0" subroom1_id="0" room2_id="-1" subroom2_id="-1">
			<vertex px="0.0" py="12.0" />
			<vertex px="0.0" py="18.0" />
		</transition>
		<transition id="3" caption="exit" type="emergency"
			room1_id="0" subroom1_id="0" room2_id="-1" subroom2_id="-1">
			<vertex px="12.0" py="30.0" />
			<vertex px="18.0" py="30.0" />
		</transition>
		<transition id="4" caption="exit" type="emergency"
			room1_id="0" subroom1_id="0" room2_id="-1" subroom2_id="-1">
			<vertex px="30.0" py="12.0" />
			<vertex px="30.0" py="18.0" />
		</transition>
		<transition id="5" caption="exit" type="emergency"
			room1_id="0" subroom1_id="0" room2_id="-1" subroom2_id="-1">
			<vertex px="12.0" py="0.0" />
			<vertex px="18.0" py="0.0" />
		</transition>
	</transitions>
</geometry>