<?xml version="1.0" encoding="UTF-8" standalone="yes" ?>
<geometry version="0.8" caption="flow regulation" xmlns:xsi="http://www.w3.org/2001/XMLSchema-instance" xsi:noNamespaceSchemaLocation="http://xsd.jupedsim.org/jps_geometry.xsd" unit="m">
    <rooms>
        <room id="0" caption="floor">
            <subroom id="1" caption="Room 1" class="Not specified" A_x="0" B_y="0" C_z="0">
                <polygon caption="wall">
                    <vertex px="0" py="0" />
                    <vertex px="0" py="10" />
                </polygon>
                <polygon caption="wall">
                    <vertex px="0" py="10" />
                    <vertex px="10" py="10" />
                </polygon>
                <polygon caption="wall">
                    <vertex px="10" py="10" />
                    <vertex px="10" py="5.5"/>
                </polygon>
                <polygon caption="wall">
                    <vertex px="10" py="4.5"/>
                    <vertex px="10" py="0" />
                </polygon>
                <polygon caption="wall">
                    <vertex px="10" py="0" />
                    <vertex px="0" py="0" />
                </polygon>
            </subroom>
            <crossings />
        </room>
    </rooms>
    <transitions>
        <transition id="0" caption="NaN" type="NaN" room1_id="0" subroom1_id="1" room2_id="-1" subroom2_id="-1">
            <vertex px="10" py="4.5"/>
            <vertex px="10" py="5.5"/>
        </transition>
    </transitions>
</geometry>
