<?xml version="1.0" encoding="UTF-8" standalone="yes"?>
<geometry version="0.8" caption="corner" xmlns:xsi="http://www.w3.org/2001/XMLSchema-instance" xsi:noNamespaceSchemaLocation="http://xsd.jupedsim.org/jps_geometry.xsd" unit="m">
    <rooms>
        <room id="0" caption="floor">
            <subroom id="1" caption="Room 1" class="Corridor" A_x="0" B_y="0" C_z="0">
                <polygon caption="wall">
                    <vertex px="14.12" py="0.92"/>
                    <vertex px="17.12" py="0.92"/>
                </polygon>
                <polygon caption="wall">
                    <vertex px="14.12" py="0.92"/>
                    <vertex px="14.12" py="1.92"/>
                </polygon>
                <polygon caption="wall">
                    <vertex px="14.12" py="10.32"/>
                    <vertex px="14.12" py="4.32"/>
                </polygon>
                <polygon caption="wall">
                    <vertex px="14.12" py="10.32"/>
                    <vertex px="17.12" py="10.32"/>
                </polygon>
            </subroom>
            <subroom id="2" caption="Room 2" class="Corridor" A_x="0" B_y="0" C_z="0">
                <polygon caption="wall">
                    <vertex px="2.12" py="1.92"/>
                    <vertex px="2.12" py="0.92"/>
                </polygon>
                <polygon caption="wall">
                    <vertex px="2.12" py="10.32"/>
                    <vertex px="-0.88" py="10.32"/>
                </polygon>
                <polygon caption="wall">
                    <vertex px="2.12" py="0.92"/>
                    <vertex px="-0.88" py="0.92"/>
                </polygon>
                <polygon caption="wall">
                    <vertex px="2.12" py="4.32"/>
                    <vertex px="2.12" py="10.32"/>
                </polygon>
            </subroom>
            <subroom id="3" caption="Room 3" class="Corridor" A_x="0" B_y="0" C_z="0">
                <polygon caption="wall">
                    <vertex px="8.12" py="0.92"/>
                    <vertex px="14.12" py="0.92"/>
                </polygon>
                <polygon caption="wall">
                    <vertex px="2.12" py="0.92"/>
                    <vertex px="8.12" py="0.92"/>
                </polygon>
                <polygon caption="wall">
                    <vertex px="14.12" py="0.92"/>
                    <vertex px="14.12" py="1.92"/>
                </polygon>
                <polygon caption="wall">
                    <vertex px="14.12" py="10.32"/>
                    <vertex px="14.12" py="4.32"/>
                </polygon>
                <polygon caption="wall">
                    <vertex px="2.12" py="1.92"/>
                    <vertex px="2.12" py="0.92"/>
                </polygon>
                <polygon caption="wall">
                    <vertex px="2.12" py="4.32"/>
                    <vertex px="2.12" py="10.32"/>
                </polygon>
                <polygon caption="wall">
                    <vertex px="8.12" py="10.32"/>
                    <vertex px="14.12" py="10.32"/>
                </polygon>
                <polygon caption="wall">
                    <vertex px="2.12" py="10.32"/>
                    <vertex px="8.12" py="10.32"/>
                </polygon>
                <obstacle id="0" caption="Obstacle 0" closed="1">
                    <polygon>
                        <vertex px="8.12" py="8.82"/>
                        <vertex px="8.12" py="9.82"/>
                    </polygon>
                    <polygon>
                        <vertex px="8.12" py="9.82"/>
                        <vertex px="8.27" py="9.82"/>
                    </polygon>
                    <polygon>
                        <vertex px="8.12" py="8.82"/>
                        <vertex px="8.27" py="8.82"/>
                    </polygon>
                    <polygon>
                        <vertex px="8.27" py="9.82"/>
                        <vertex px="8.27" py="8.82"/>
                    </polygon>
                </obstacle>
                <obstacle id="1" caption="Obstacle 1" closed="1">
                    <polygon>
                        <vertex px="8.12" py="7.82"/>
                        <vertex px="8.12" py="6.82"/>
                    </polygon>
                    <polygon>
                        <vertex px="8.12" py="7.82"/>
                        <vertex px="8.27" py="7.82"/>
                    </polygon>
                    <polygon>
                        <vertex px="8.12" py="6.82"/>
                        <vertex px="8.27" py="6.82"/>
                    </polygon>
                    <polygon>
                        <vertex px="8.27" py="7.82"/>
                        <vertex px="8.27" py="6.82"/>
                    </polygon>
                </obstacle>
                <obstacle id="2" caption="Obstacle 2" closed="1">
                    <polygon>
                        <vertex px="8.12" py="5.82"/>
                        <vertex px="8.12" py="3.82"/>
                    </polygon>
                    <polygon>
                        <vertex px="8.12" py="5.82"/>
                        <vertex px="8.27" py="5.82"/>
                    </polygon>
                    <polygon>
                        <vertex px="8.12" py="3.82"/>
                        <vertex px="8.27" py="3.82"/>
                    </polygon>
                    <polygon>
                        <vertex px="8.27" py="5.82"/>
                        <vertex px="8.27" py="3.82"/>
                    </polygon>
                </obstacle>
                <obstacle id="3" caption="Obstacle 3" closed="1">
                    <polygon>
                        <vertex px="8.12" py="2.82"/>
                        <vertex px="8.12" py="1.32"/>
                    </polygon>
                    <polygon>
                        <vertex px="8.12" py="2.82"/>
                        <vertex px="8.27" py="2.82"/>
                    </polygon>
                    <polygon>
                        <vertex px="8.27" py="2.82"/>
                        <vertex px="8.27" py="1.32"/>
                    </polygon>
                    <polygon>
                        <vertex px="8.27" py="1.32"/>
                        <vertex px="8.12" py="1.32"/>
                    </polygon>
                </obstacle>
            </subroom>
            <crossings>
                <crossing id="1" subroom1_id="1" subroom2_id="3">
                    <vertex px="14.12" py="1.92"/>
                    <vertex px="14.12" py="4.32"/>
                </crossing>
                <crossing id="3" subroom1_id="2" subroom2_id="3">
                    <vertex px="2.12" py="4.32"/>
                    <vertex px="2.12" py="1.92"/>
                </crossing>
            </crossings>
        </room>
    </rooms>
    <transitions>
        <transition id="0" caption="NaN" type="NaN" room1_id="0" subroom1_id="1" room2_id="-1" subroom2_id="-1">
            <vertex px="17.12" py="10.32"/>
            <vertex px="17.12" py="0.92"/>
        </transition>
        <transition id="1" caption="NaN" type="NaN" room1_id="0" subroom1_id="2" room2_id="-1" subroom2_id="-1">
            <vertex px="-0.88" py="10.32"/>
            <vertex px="-0.88" py="0.92"/>
        </transition>
    </transitions>
</geometry>
