<?xml version="1.0" encoding="UTF-8" standalone="yes"?>
<geometry version="0.8" caption="Basigo2" xmlns:xsi="http://www.w3.org/2001/XMLSchema-instance" xsi:noNamespaceSchemaLocation="http://xsd.jupedsim.org/jps_geometry.xsd" unit="m">
    <rooms>
        <room id="0" caption="hall">
            <subroom id="0">
                <polygon caption="westwall1">
                    <vertex px="0.0" py="0.0"/>
                    <vertex px="0.0" py="4.0"/>
                </polygon>
                <polygon caption="westwall2">
                    <vertex px="0.0" py="4.8"/>
                    <vertex px="0.0" py="8.8"/>
                </polygon>
                <polygon caption="nortwall1">
                    <vertex px="0.0" py="8.8"/>
                    <vertex px="4.0" py="8.8"/>
                </polygon>
                <polygon caption="northwall2">
                    <vertex px="4.8" py="8.8"/>
                    <vertex px="8.8" py="8.8"/>
                </polygon>
                <polygon caption="eastwall1">
                    <vertex px="8.8" py="8.8"/>
                    <vertex px="8.8" py="4.8"/>
                </polygon>
                <polygon caption="eastwall2">
                    <vertex px="8.8" py="4.0"/>
                    <vertex px="8.8" py="0.0"/>
                </polygon>
                <polygon caption="southwall1">
                    <vertex px="0.0" py="0.0"/>
                    <vertex px="4.0" py="0.0"/>
                </polygon>
                <polygon caption="southwall2">
                    <vertex px="4.8" py="0.0"/>
                    <vertex px="8.8" py="0.0"/>
                </polygon>
            </subroom>
        </room>
        <crossings/>
    </rooms>
    <transitions>
        <transition id="1" caption="exit west" type="emergency" room1_id="0" subroom1_id="0" room2_id="-1" subroom2_id="-1">
            <vertex px="0.0" py="4.0"/>
            <vertex px="0.0" py="4.8"/>
        </transition>
        <transition id="2" caption="exit north" type="emergency" room1_id="0" subroom1_id="0" room2_id="-1" subroom2_id="-1">
            <vertex px="4" py="8.8"/>
            <vertex px="4.8" py="8.8"/>
        </transition>
        <transition id="3" caption="exit east" type="emergency" room1_id="0" subroom1_id="0" room2_id="-1" subroom2_id="-1">
            <vertex px="8.8" py="4.8"/>
            <vertex px="8.8" py="4.0"/>
        </transition>
        <transition id="4" caption="exit south" type="emergency" room1_id="0" subroom1_id="0" room2_id="-1" subroom2_id="-1">
            <vertex px="4" py="0.0"/>
            <vertex px="4.8" py="0.0"/>
        </transition>
    </transitions>
</geometry>
