<?xml version="1.0" encoding="UTF-8" standalone="yes"?>

<geometry version="0.8" caption="hybrid test" unit="m" xmlns:xsi="http://www.w3.org/2001/XMLSchema-instance" xsi:noNamespaceSchemaLocation="http://xsd.jupedsim.org/0.6/jps_geometry.xsd">
  <rooms>
    <room id="0" caption="hall0">
      <subroom id="0" closed="0" class="floor">
        <polygon caption="wall">
          <vertex px="0.0" py="2.8" />
          <vertex px="0.0" py="0.0" />
          <vertex px="3.6" py="0.0" />
        </polygon>
        <polygon caption="wall">
          <vertex px="5.2" py="0.0" />
          <vertex px="9.2" py="0.0" />
          <vertex px="9.2" py="2.8" />
        </polygon>
        <polygon caption="wall">
          <vertex px="9.2" py="6.4" />
          <vertex px="9.2" py="9.2" />
          <vertex px="5.6" py="9.2" />
        </polygon>
        <polygon caption="wall">
          <vertex px="3.2" py="9.2" />
          <vertex px="0.0" py="9.2" />
          <vertex px="0.0" py="6.4" />
        </polygon>
      </subroom>
    </room>
    <room id="1" caption="hall1">
      <subroom id="0" closed="0" class="floor">
        <polygon caption="wall">
          <vertex px="3.6" py="-2.0" />
          <vertex px="3.6" py="0.0" />
        </polygon>
        <polygon caption="wall">
          <vertex px="5.2" py="-2.0" />
          <vertex px="5.2" py="0.0" />
        </polygon>
      </subroom>
    </room>
    <room id="2" caption="hall2">
      <subroom id="0" closed="0" class="floor">
        <polygon caption="wall">
          <vertex px="9.2" py="2.8" />
          <vertex px="13.2" py="2.8" />
        </polygon>
        <polygon caption="wall">
          <vertex px="9.2" py="6.4" />
          <vertex px="13.2" py="6.4" />
        </polygon>
      </subroom>
      <subroom id="1" closed="0" class="floor">
        <polygon caption="wall">
          <vertex px="13.2" py="2.8" />
          <vertex px="17.2" py="2.8" />
        </polygon>
        <polygon caption="wall">
          <vertex px="13.2" py="6.4" />
          <vertex px="17.2" py="6.4" />
        </polygon>
      </subroom>
      <crossings>
	<crossing id="0" subroom1_id="0" subroom2_id="1">
	  <vertex px="13.2" py="2.8" /> 
	  <vertex px="13.2" py="6.4" />
	</crossing> 
      </crossings>
    </room>
    <room id="3" caption="hall3">
      <subroom id="0" closed="0" class="floor">
        <polygon caption="wall">
          <vertex px="3.2" py="9.2" />
          <vertex px="3.2" py="11.2" />
        </polygon>
        <polygon caption="wall">
          <vertex px="5.6" py="9.2" />
          <vertex px="5.6" py="11.2" />
        </polygon>
      </subroom>
    </room>
    <room id="4" caption="hall4">
      <subroom id="0" closed="0" class="floor">
        <polygon caption="wall">
          <vertex px="0.0" py="2.8" />
          <vertex px="-2.0" py="2.8" />
        </polygon>
        <polygon caption="wall">
          <vertex px="0.0" py="6.4" />
          <vertex px="-2.0" py="6.4" />
        </polygon>
      </subroom>
    </room>
  </rooms>

  <transitions>
    <transition id="0" caption="exit" type="emergency" room1_id="0" subroom1_id="0" room2_id="1" subroom2_id="0">
      <vertex px="3.6" py="0.0" />
      <vertex px="5.2" py="0.0" />
    </transition>
    <transition id="1" caption="exit" type="emergency" room1_id="0" subroom1_id="0" room2_id="2" subroom2_id="0">
      <vertex px="9.2" py="2.8" />
      <vertex px="9.2" py="6.4" />
    </transition>
    <transition id="2" caption="exit" type="emergency" room1_id="0" subroom1_id="0" room2_id="3" subroom2_id="0">
      <vertex px="3.2" py="9.2" />
      <vertex px="5.6" py="9.2" />
    </transition>
    <transition id="3" caption="exit" type="emergency" room1_id="0" subroom1_id="0" room2_id="4" subroom2_id="0">
      <vertex px="0.0" py="2.8" />
      <vertex px="0.0" py="6.4" />
    </transition>
    <transition id="4" caption="exit" type="emergency" room1_id="1" subroom1_id="0" room2_id="-1" subroom2_id="-1">
      <vertex px="3.6" py="-2.0" />
      <vertex px="5.20" py="-2.0" />
    </transition>
    <transition id="5" caption="exit" type="emergency" room1_id="2" subroom1_id="1" room2_id="-1" subroom2_id="-1">
      <vertex px="17.2" py="2.8" />
      <vertex px="17.2" py="6.4" />
    </transition>
    <transition id="6" caption="exit" type="emergency" room1_id="3" subroom1_id="0" room2_id="-1" subroom2_id="-1">
      <vertex px="3.2" py="11.2" />
      <vertex px="5.6" py="11.2" />
    </transition>
    <transition id="7" caption="exit" type="emergency" room1_id="4" subroom1_id="0" room2_id="-1" subroom2_id="-1">
      <vertex px="-2.0" py="2.8" />
      <vertex px="-2.0" py="6.4" />
    </transition>
  </transitions>
</geometry>
