<?xml version="1.0" encoding="UTF-8" standalone="yes"?>
<geometry version="0.8" caption="corner" xmlns:xsi="http://www.w3.org/2001/XMLSchema-instance" xsi:noNamespaceSchemaLocation="http://xsd.jupedsim.org/jps_geometry.xsd" unit="m">
    <rooms>
        <room id="0" caption="hall">
            <subroom id="0" caption="Room 0" class="subroom">
                <polygon caption="wall">
                    <vertex px="10.1775" py="17.4988"/>
                    <vertex px="5.17747" py="17.4988"/>
                </polygon>
                <polygon caption="wall">
                    <vertex px="5.17747" py="17.4988"/>
                    <vertex px="5.17747" py="13.8988"/>
                </polygon>
                <polygon caption="wall">
                    <vertex px="5.17747" py="13.8988"/>
                    <vertex px="10.1775" py="13.8988"/>
                </polygon>
                <polygon caption="wall">
                    <vertex px="14.1775" py="17.4988"/>
                    <vertex px="22.1775" py="17.4988"/>
                </polygon>
                <polygon caption="wall">
                    <vertex px="14.1775" py="13.8988"/>
                    <vertex px="22.1775" py="13.8988"/>
                </polygon>
                <polygon caption="wall">
                    <vertex px="26.1775" py="17.4988"/>
                    <vertex px="31.1775" py="17.4988"/>
                </polygon>
                <polygon caption="wall">
                    <vertex px="26.1775" py="13.8988"/>
                    <vertex px="31.1775" py="13.8988"/>
                </polygon>
                <polygon caption="wall">
                    <vertex px="31.1775" py="17.4988"/>
                    <vertex px="31.1775" py="13.8988"/>
                </polygon>
            </subroom>
            <crossings/>
        </room>
    </rooms>
    <transitions>
        <transition id="0" caption="lefttop" type="emergency" room1_id="0" subroom1_id="0" room2_id="-1" subroom2_id="-1">
            <vertex px="10.1775" py="17.4988"/>
            <vertex px="14.1775" py="17.4988"/>
        </transition>
        <transition id="1" caption="leftbottom" type="emergency" room1_id="0" subroom1_id="0" room2_id="-1" subroom2_id="-1">
            <vertex px="10.1775" py="13.8988"/>
            <vertex px="14.1775" py="13.8988"/>
        </transition>
        <transition id="2" caption="righttop" type="emergency" room1_id="0" subroom1_id="0" room2_id="-1" subroom2_id="-1">
            <vertex px="22.1775" py="17.4988"/>
            <vertex px="26.1775" py="17.4988"/>
        </transition>
        <transition id="3" caption="rightbottom" type="emergency" room1_id="0" subroom1_id="0" room2_id="-1" subroom2_id="-1">
            <vertex px="22.1775" py="13.8988"/>
            <vertex px="26.1775" py="13.8988"/>
        </transition>
    </transitions>
</geometry>
