<?xml version="1.0" encoding="UTF-8" standalone="yes"?>

<geometry version="0.5" caption="second life" unit="m"
          xmlns:xsi="http://www.w3.org/2001/XMLSchema-instance"
          xsi:noNamespaceSchemaLocation="../../xsd/jps_geometry.xsd">
  <rooms>
    <room id="0" caption="hall">
      <subroom id="0" closed="0" class="subroom">
	<polygon caption="wall">
	  <vertex px="28.0" py="20.0" />
	  <vertex px="30.0" py="20.0" />
	  <vertex px="30.0" py="0.0" />
	  <vertex px="0.0" py="0.0" />
	  <vertex px="0.0" py="20.0" />
	  <vertex px="21.0" py="20.0" />
	</polygon>
	<polygon caption="wall_doors">
	  <vertex px="22.0" py="20.0" />
	  <vertex px="27.0" py="20.0" />
	</polygon>
	<!-- <polygon caption="wall_doors2"> -->
	<!--   <vertex px="21.0" py="20.0" /> -->
	<!--   <vertex px="21.0" py="20.5" /> -->
	<!-- </polygon> -->
        <!-- <polygon caption="wall_doors3"> -->
        <!--   <vertex px="22.0" py="20.0" /> -->
	<!--   <vertex px="22.0" py="20.5" /> -->
	<!-- </polygon> -->
        <!-- <polygon caption="wall_doors4"> -->
        <!--   <vertex px="27.0" py="20.0" /> -->
	<!--   <vertex px="27.0" py="20.5" /> -->
	<!-- </polygon> -->
        <!-- <polygon caption="wall_doors5"> -->
        <!--   <vertex px="28.0" py="20.0" /> -->
	<!--   <vertex px="28.0" py="20.5" /> -->
	<!-- </polygon> -->
      </subroom>
    </room>
   
  </rooms>

  <transitions>
    <!-- exits like crossings but between rooms or to outside (room with index
	 = -1) -->
    <transition id="0" caption="exit_1" type="emergency"
		room1_id="0" subroom1_id="0" room2_id="-1" subroom2_id="-1">
      <vertex px="21.0" py="20.0" />
      <vertex px="22.0" py="20.0" />
    </transition>
    
    <transition id="1" caption="exit_2" type="emergency"
		room1_id="0" subroom1_id="0" room2_id="-1" subroom2_id="-1">
      <vertex px="27.0" py="20.0" />
      <vertex px="28.0" py="20.0" />
    </transition>
    
  </transitions>
</geometry>
