<?xml version="1.0" encoding="UTF-8" standalone="yes"?>
<geometry version="0.8" caption="corner" xmlns:xsi="http://www.w3.org/2001/XMLSchema-instance" xsi:noNamespaceSchemaLocation="http://xsd.jupedsim.org/jps_geometry.xsd" unit="m">
    <rooms>
        <room id="0" caption="hall">
          <subroom id="1" caption="Room 1" class="Hall" A_x="0" B_y="0" C_z="0">
                <polygon caption="wall">
                  <vertex px=" 0.0" py=" 0.0"/>
                  <vertex px=" 0.0" py="20.0"/>
                </polygon>
              <polygon caption="wall">
                  <vertex px=" 0.0" py="20.0"/>
                  <vertex px="20.0" py="20.0"/>
              </polygon>
              <polygon caption="wall">
                  <vertex px="20.0" py="20.0"/>
                  <vertex px="20.0" py="10.5"/>
              </polygon>
              <polygon caption="wall">
                  <vertex px="20.0" py=" 9.5"/>
                  <vertex px="20.0" py=" 0.0"/>
              </polygon>
              <polygon caption="wall">
                  <vertex px="20.0" py=" 0.0"/>
                  <vertex px=" 0.0" py=" 0.0"/>
              </polygon>
          </subroom>
          <subroom id="2" caption="Room 2" class="Hall" A_x="0" B_y="0" C_z="0">
              <polygon caption="wall">
                  <vertex px="20.0" py="10.5"/>
                  <vertex px="28.0" py="10.5"/>
              </polygon>
              <polygon caption="wall">
                  <vertex px="28.0" py=" 9.5"/>
                  <vertex px="20.0" py=" 9.5"/>
              </polygon>
          </subroom>
          <subroom id="3" caption="Room 2" class="Hall" A_x="0" B_y="0" C_z="0">
              <polygon caption="wall">
                  <vertex px="28.0" py="10.5"/>
                  <vertex px="28.0" py="20.0"/>
              </polygon>
              <polygon caption="wall">
                  <vertex px="28.0" py="20.0"/>
                  <vertex px="48.0" py="20.0"/>
              </polygon>
              <polygon caption="wall">
                  <vertex px="48.0" py="20.0"/>
                  <vertex px="48.0" py="11.0"/>
              </polygon>
              <polygon caption="wall">
                  <vertex px="48.0" py=" 9.0"/>
                  <vertex px="48.0" py=" 0.0"/>
              </polygon>
              <polygon caption="wall">
                  <vertex px="48.0" py=" 0.0"/>
                  <vertex px="28.0" py=" 0.0"/>
              </polygon>
              <polygon caption="wall">
                  <vertex px="28.0" py=" 0.0"/>
                  <vertex px="28.0" py=" 9.5"/>
              </polygon>
          </subroom>

          <crossings>
            <crossing id="0" subroom1_id ="1" subroom2_id ="2">
                <vertex px=" 20.0 " py=" 9.5 "/>
                <vertex px=" 20.0 " py="10.5 "/>
            </crossing>
            <crossing id="1" subroom1_id ="2" subroom2_id ="3">
              <vertex px=" 28.0 " py=" 9.5 "/>
              <vertex px=" 28.0 " py="10.5 "/>
            </crossing>
          </crossings>

        </room>
    </rooms>

    <transitions>
      <transition id="0" caption="NaN" type="NaN" room1_id="0" subroom1_id="3" room2_id="-1" subroom2_id="-1">
        <vertex px="48.0" py=" 9.0"/>
        <vertex px="48.0" py="11.0"/>
      </transition>
    </transitions>

</geometry>
