<?xml version="1.0" encoding="UTF-8" standalone="yes"?>
<geometry version="0.8" caption="corner" xmlns:xsi="http://www.w3.org/2001/XMLSchema-instance" xsi:noNamespaceSchemaLocation="http://xsd.jupedsim.org/jps_geometry.xsd" unit="m">
    <rooms>
        <room id="1" caption="floor">
            <subroom id="1" caption="Room 1" class="Not specified" A_x="0" B_y="0" C_z="0">
                <polygon caption="wall">
                    <vertex px="0" py="4"/>
                    <vertex px="0" py="8"/>
                </polygon>
                <polygon caption="wall">
                    <vertex px="0" py="6"/>
                    <vertex px="-2" py="6"/>
                </polygon>
                <polygon caption="wall">
                    <vertex px="-2" py="6"/>
                    <vertex px="-2" py="4"/>
                </polygon>
                <polygon caption="wall">
                    <vertex px="-2" py="4"/>
                    <vertex px="2" py="4"/>
                </polygon>
            </subroom>
            <crossings/>
        </room>
        <room id="2" caption="floor">
            <subroom id="2" caption="Room 2" class="Not specified" A_x="0" B_y="0" C_z="0">
                <polygon caption="wall">
                    <vertex px="0" py="4"/>
                    <vertex px="2" py="6"/>
                </polygon>
                <polygon caption="wall">
                    <vertex px="0" py="4"/>
                    <vertex px="0" py="8"/>
                </polygon>
                <polygon caption="wall">
                    <vertex px="0" py="6"/>
                    <vertex px="2" py="6"/>
                </polygon>
            </subroom>
            <crossings/>
        </room>
        <room id="3" caption="floor">
            <subroom id="3" caption="Room 3" class="Not specified" A_x="0" B_y="0" C_z="0">
                <polygon caption="wall">
                    <vertex px="0" py="4"/>
                    <vertex px="0" py="8"/>
                </polygon>
                <polygon caption="wall">
                    <vertex px="0" py="8"/>
                    <vertex px="2" py="8"/>
                </polygon>
                <polygon caption="wall">
                    <vertex px="2" py="8"/>
                    <vertex px="2" py="6"/>
                </polygon>
                <polygon caption="wall">
                    <vertex px="0" py="6"/>
                    <vertex px="2" py="6"/>
                </polygon>
            </subroom>
            <crossings/>
        </room>
        <room id="4" caption="floor">
            <subroom id="4" caption="Room 4" class="Not specified" A_x="0" B_y="0" C_z="0">
                <polygon caption="wall">
                    <vertex px="0" py="4"/>
                    <vertex px="2" py="6"/>
                </polygon>
                <polygon caption="wall">
                    <vertex px="-2" py="4"/>
                    <vertex px="2" py="4"/>
                </polygon>
                <polygon caption="wall">
                    <vertex px="2" py="4"/>
                    <vertex px="2" py="6"/>
                </polygon>
            </subroom>
            <crossings/>
        </room>
    </rooms>
    
    <transitions>
        <transition id="1" caption="exit1" type="NaN" room1_id="1" subroom1_id="1" room2_id="-1" subroom2_id="-1">
            <vertex px="-2" py="4.5"/>
            <vertex px="-2" py="5.5"/>
        </transition>
        <transition id="2" caption="exit2" type="NaN" room1_id="3" subroom1_id="3" room2_id="-1" subroom2_id="-1">
            <vertex px="0.5" py="8"/>
            <vertex px="1.5" py="8"/>
        </transition>
        
        <transition id="3" caption="cross1" type="NaN" room1_id="1" subroom1_id="1" room2_id="2" subroom2_id="2">
            <vertex px="0" py="4.5"/>
            <vertex px="0" py="5.5"/>
        </transition>
        <transition id="4" caption="cross2" type="NaN" room1_id="2" subroom1_id="2" room2_id="3" subroom2_id="3">
            <vertex px="0.5" py="6"/>
            <vertex px="1.5" py="6"/>
        </transition>
        <transition id="5" caption="cross3" type="NaN" room1_id="2" subroom1_id="2" room2_id="4" subroom2_id="4">
            <vertex px="0.5" py="4.5"/>
            <vertex px="1.5" py="5.5"/>
        </transition>
    </transitions>
</geometry>
