<?xml version="1.0" encoding="UTF-8" standalone="yes"?>
<geometry version="0.8" caption="corner" xmlns:xsi="http://www.w3.org/2001/XMLSchema-instance" xsi:noNamespaceSchemaLocation="http://xsd.jupedsim.org/jps_geometry.xsd" unit="m">
  <rooms>
    <room id="0" caption="floor">
      <subroom id="1" caption="Room 1" class="Not specified" A_x="0" B_y="0" C_z="0">
        <polygon caption="wall">
          <vertex px="0" py="5"/>
          <vertex px="0" py="0"/>
        </polygon>
        <polygon caption="wall">
          <vertex px="4" py="5"/>
          <vertex px="4" py="4"/>
        </polygon>
        <polygon caption="wall">
          <vertex px="4" py="3"/>
          <vertex px="4" py="2"/>
        </polygon>
        <polygon caption="wall">
          <vertex px="4" py="1"/>
          <vertex px="4" py="0"/>
        </polygon>
        <polygon caption="wall">
          <vertex px="0" py="5"/>
          <vertex px="4" py="5"/>
        </polygon>
        <polygon caption="wall">
          <vertex px="4" py="0"/>
          <vertex px="0" py="0"/>
        </polygon>
        <obstacle id="0" caption="Obstacle 0" closed="1">
          <polygon>
            <vertex px="1" py="1.5"/>
            <vertex px="1.5" py="1.5"/>
          </polygon>
          <polygon>
            <vertex px="1.5" py="1"/>
            <vertex px="1.5" py="1.5"/>
          </polygon>
          <polygon>
            <vertex px="1" py="1.5"/>
            <vertex px="1" py="1"/>
          </polygon>
          <polygon>
            <vertex px="1" py="1"/>
            <vertex px="1.5" py="1"/>
          </polygon>
        </obstacle>
        <obstacle id="1" caption="Obstacle 1" closed="1">
          <polygon>
            <vertex px="2" py="4"/>
            <vertex px="2.5" py="4"/>
          </polygon>
          <polygon>
            <vertex px="2" py="4"/>
            <vertex px="2" py="3.5"/>
          </polygon>
          <polygon>
            <vertex px="2" py="3.5"/>
            <vertex px="2.5" py="3.5"/>
          </polygon>
          <polygon>
            <vertex px="2.5" py="4"/>
            <vertex px="2.5" py="3.5"/>
          </polygon>
        </obstacle>
      </subroom>
      </room>
      <room id="1" caption="floor">
        <subroom id="1" caption="Room 2" class="Not specified" A_x="0" B_y="0" C_z="0">
          <polygon caption="wall">
            <vertex px="8" py="0"/>
            <vertex px="8" py="2"/>
          </polygon>
          <polygon caption="wall">
            <vertex px="8" py="5"/>
            <vertex px="8" py="3"/>
          </polygon>
          <polygon caption="wall">
            <vertex px="4" py="5"/>
            <vertex px="4" py="4"/>
          </polygon>
          <polygon caption="wall">
            <vertex px="4" py="3"/>
            <vertex px="4" py="2"/>
          </polygon>
          <polygon caption="wall">
            <vertex px="4" py="1"/>
            <vertex px="4" py="0"/>
          </polygon>
          <polygon caption="wall">
            <vertex px="4" py="5"/>
            <vertex px="8" py="5"/>
          </polygon>
          <polygon caption="wall">
            <vertex px="8" py="0"/>
            <vertex px="4" py="0"/>
          </polygon>
          <obstacle id="2" caption="Obstacle 2" closed="1">
            <polygon>
              <vertex px="6" py="3"/>
              <vertex px="5.5" py="2.5"/>
            </polygon>
            <polygon>
              <vertex px="5.5" py="2.5"/>
              <vertex px="5.5" py="2"/>
            </polygon>
            <polygon>
              <vertex px="5.5" py="2"/>
              <vertex px="6" py="1.5"/>
            </polygon>
            <polygon>
              <vertex px="6" py="1.5"/>
              <vertex px="6.5" py="1.5"/>
            </polygon>
            <polygon>
              <vertex px="6.5" py="1.5"/>
              <vertex px="7" py="2"/>
            </polygon>
            <polygon>
              <vertex px="7" py="2"/>
              <vertex px="7" py="2.5"/>
            </polygon>
            <polygon>
              <vertex px="7" py="2.5"/>
              <vertex px="6.5" py="3"/>
            </polygon>
            <polygon>
              <vertex px="6.5" py="3"/>
              <vertex px="6" py="3"/>
            </polygon>
          </obstacle>
        </subroom>
      </room>
      <room id="2" caption="floor">
        <subroom id="1" caption="Room 3" class="Not specified" A_x="0" B_y="0" C_z="0">
          <polygon caption="wall">
            <vertex px="8" py="0"/>
            <vertex px="8" py="2"/>
          </polygon>
          <polygon caption="wall">
            <vertex px="8" py="5"/>
            <vertex px="8" py="3"/>
          </polygon>
          <polygon caption="wall">
            <vertex px="8" py="5"/>
            <vertex px="11" py="4"/>
          </polygon>
          <polygon caption="wall">
            <vertex px="8" py="0"/>
            <vertex px="11" py="1"/>
          </polygon>
        </subroom>
      </room>
  </rooms>
  <transitions>
    <transition id="0" caption="exit" type="emergency" room1_id="2" subroom1_id="1" room2_id="-1" subroom2_id="-1">
      <vertex px="11" py="1"/>
      <vertex px="11" py="4"/>
    </transition>
    
    <transition id="1" caption="exit" type="emergency" room1_id="1" subroom1_id="1" room2_id="2" subroom2_id="1">
      <vertex px="8" py="2"/>
      <vertex px="8" py="3"/>
    </transition>
    <transition id="2" caption="exit" type="emergency" room1_id="0" subroom1_id="1" room2_id="1" subroom2_id="1">
      <vertex px="4" py="4"/>
      <vertex px="4" py="3"/>
    </transition>
    <transition id="3" caption="exit" type="emergency" room1_id="0" subroom1_id="1" room2_id="1" subroom2_id="1">
      <vertex px="4" py="2"/>
      <vertex px="4" py="1"/>          
    </transition>
  </transitions>
</geometry>
